Sheet: data
A1: id | B1: template | C1: date | D1: modelLife | E1: vehicleLife | F1: costFactor | G1: runningCostFactor | H1: speed | I1: power | J1: weight | K1: tec | L1: engine | M1: gauge | N1: service | O1: length | P1: imageFile | Q1: effect | R1: info | S1: liveriesNumber | T1: liveriesFiles | U1: liveriesYears | V1: Uac
A2: 250_alemana | B2: template | C2: date(1982,01,01) | D2: 7 | E2: 28 | F2: 0 | G2: 0 | H2: 160 km/h | I2: 4600 kW | J2: 124 ton | K2: 0.3373930217 | L2: electric | M2: iberian | N2: ephf | O2: 8 | P2: 250/250 | Q2: 0 | R2: 1 | S2: -1 | T2: [estrella, taxi, 2cc] | U2: [0,1985,1986,1989,1990,9999,0,9999] | V2: cc
A3: 251_japonesa_y_media | B3: template | C3: date(1981,01,01) | D3: 3 | E3: 40 | F3: 0 | G3: 0 | H3: 160 km/h | I3: 4650 kW | J3: 138 ton | K3: 0.3349600709 | L3: electric | M3: iberian | N3: ephf | O3: 8 | P3: 251/251 | Q3: 0 | R3: 0 | S3: -1 | T3: [taxi, taxitone, pantone, 2cc] | U3: [0,1989,1990,2003,2004,2008,2009,9999,0,9999] | V3: bbb
A4: 252_eurosprinter_iberian | B4: template | C4: date(1992,01,01) | D4: 3 | E4: 30 | F4: 0 | G4: 0 | H4: 220 km/h | I4: 5600 kW | J4: 86 ton | K4: 0.355956336 | L4: electric | M4: iberian | N4: eplf | O4: 8 | P4: 252_iberian/252 | Q4: 0 | R4: 1 | S4: -1 | T4: [altaria, arco, taxi, pantone_pasajeros, pantone_mercancias, 2cc] | U4: [0,2004,0,2020,0,2020,0,2004,2005,9999,2005,9999,0,9999] | V4: bobo
A5: 252_eurosprinter_standard | B5: template | C5: date(1991,01,01) | D5: 3 | E5: 30 | F5: 0 | G5: 0 | H5: 220 km/h | I5: 5600 kW | J5: 90 ton | K5: 0.355956336 | L5: electric | M5: standard | N5: eplf | O5: 8 | P5: 252_standard/252 | Q5: 0 | R5: 1 | S5: -1 | T5: [altaria, pantone_pasajeros, pantone_mercancias, 2cc] | U5: [0,2004,2001,2011,2005,9999,2005,9999,0,9999] | V5: bobo
A6: 253_traxx | B6: template | C6: date(2008,01,01) | D6: 3 | E6: 13 | F6: 0 | G6: 0 | H6: 140 km/h | I6: 5400 kW | J6: 85 ton | K6: 0.360144057623049 | L6: electric | M6: iberian | N6: f | O6: 8 | P6: 253/253 | Q6: 0 | R6: 0 | S6: -1 | T6: [comsa, captrain, 2cc] | U6: [0,9999, 2007,2018, 2019, 9999, 0, 9999] | V6: bobo
A7: 260_ex6000 | B7: template | C7: date(1923,01,01) | D7: 1 | E7: 55 | F7: 0 | G7: 0 | H7: 60 km/h | I7: 1178 kW | J7: 80 ton | K7: 0.153061224489796 | L7: electric | M7: iberian | N7: pf | O7: 6 | P7: 260/260 | Q7: 0 | R7: 1 | S7: -1 | T7: [republica, post_republica, 2cc] | U7: [0,1930, 1931,1938, 1939,9999, 0,9999] | V7: coco
A8: 261_paloma | B8: template | C8: date(1924,01,01) | D8: 1 | E8: 50 | F8: 0 | G8: 0 | H8: 55 km/h | I8: 1344 kW | J8: 75 ton | K8: 0.128 | L8: electric | M8: iberian | N8: pf | O8: 8 | P8: 261/261 | Q8: 0 | R8: 0 | S8: -1 | T8: [republica, post_republica, 2cc] | U8: [0,1930, 1931,1938, 1939,9999, 0,9999] | V8: coco
A9: 269_japonesa | B9: template | C9: date(1973,01,01) | D9: 10 | E9: 48 | F9: 0 | G9: 0 | H9: 160 km/h | I9: 3100 kW | J9: 88 ton | K9: 0.253942486085343 | L9: electric | M9: iberian | N9: pf | O9: 8 | P9: 269/269 | Q9: 0 | R9: 0 | S9: -1 | T9: [mazinguer, mil_rayas, estrella, blanquilla, danone, talgo_200_blanco,talgo_200_pantone, altaria, taxi, taxitone, pantone_mercancias ,cercanias_cabeza, cercanias_cola, alquiler, alquiler_comsa, alquiler_low_cost_rail, raxell, low_cost_rail, continental_rail, alsa_rail, medway, go_transport, 2cc] | U9: [0,1989, 1981,1984, 1983,1989, 1985,1997,1992,2000, 2001,2003, 1994,2003, 2004,2006, 2001,2011, 1990,2003, 2004,2008, 2009,9999, 1990,1992, 1990,1992 , 2015,9999, 2016,2029, 2019,9999, 2018,9999, 2019,9999, 2019,9999, 2020,9999, 2020,9999, 2020,9999, 0,9999] | V9: bb
A10: 270_ex7000 | B10: template | C10: date(1928,01,01) | D10: 1 | E10: 46 | F10: 0 | G10: 0 | H10: 90 km/h | I10: 1800 kW | J10: 102 ton | K10: 0.138055222088836 | L10: electric | M10: iberian | N10: pf | O10: 8 | P10: 270/270 | Q10: 0 | R10: 1 | S10: -1 | T10: [republica, post_republica, 2cc] | U10: [0,1930, 1931,1938, 1939,9999, 0,9999] | V10: coco
A11: 274_banyera | B11: template | C11: date(1944,01,01) | D11: 4 | E11: 32 | F11: 0 | G11: 0 | H11: 100 km/h | I11: 2400 kW | J11: 99 ton | K11: 0.125747268604411 | L11: electric | M11: iberian | N11: pf | O11: 8 | P11: 274/274 | Q11: 0 | R11: 0 | S11: -1 | T11: [2cc] | U11: [0,9999, 0,9999] | V11: coco
A12: 276_francesa | B12: template | C12: date(1956,01,01) | D12: 10 | E12: 41 | F12: 0 | G12: 0 | H12: 125 km/h | I12: 3000 kW | J12: 120 ton | K12: 0.137755102040816 | L12: electric | M12: iberian | N12: pf | O12: 8 | P12: 276/276 | Q12: 0 | R12: 1 | S12: -1 | T12: [talgo, taxi, ave, 2cc] | U12: [0,1970, 1971,1989, 1990,1997, 1997,9999 ,0,9999] | V12: coco
A13: 278_pachorga | B13: template | C13: date(1954,01,01) | D13: 6 | E13: 38 | F13: 0 | G13: 0 | H13: 110 km/h | I13: 2200 kW | J13: 120 ton | K13: 0.14030612244898 | L13: electric | M13: iberian | N13: pf | O13: 8 | P13: 278/278 | Q13: 0 | R13: 1 | S13: -1 | T13: [2cc] | U13: [0,9999, 0,9999] | V13: bobobo
A14: 279_benemerita | B14: template | C14: date(1967,01,01) | D14: 2 | E14: 42 | F14: 0 | G14: 0 | H14: 130 km/h | I14: 2700 kW | J14: 80 ton | K14: 0.280612244897959 | L14: electric | M14: iberian | N14: pf | O14: 8 | P14: 279/279 | Q14: 0 | R14: 1 | S14: -1 | T14: [taxi, 2cc] | U14: [0,1989, 1990,9999, 0,9999] | V14: bb
A15: 280_ex10000 | B15: template | C15: date(1963,01,01) | D15: 1 | E15: 13 | F15: 0 | G15: 0 | H15: 120 km/h | I15: 2280 kW | J15: 79 ton | K15: 0.28158098682511 | L15: electric | M15: iberian | N15: pf | O15: 8 | P15: 280/280 | Q15: 0 | R15: 1 | S15: -1 | T15: [2cc] | U15: [0,9999, 0,9999] | V15: bb
A16: 281_ex1000 | B16: template | C16: date(1929,01,01) | D16: 2 | E16: 58 | F16: 0 | G16: 0 | H16: 65 km/h | I16: 735 kW | J16: 75 ton | K16: 0.108843537414966 | L16: electric | M16: iberian | N16: pf | O16: 7 | P16: 281/281 | Q16: 0 | R16: 1 | S16: -1 | T16: [republica, post_republica, 2cc] | U16: [0,1930, 1931,1938, 1939,9999, 0,9999] | V16: bobo
A17: 289_japonesa | B17: template | C17: date(1969,01,01) | D17: 4 | E17: 52 | F17: 0 | G17: 0 | H17: 130 km/h | I17: 3100 kW | J17: 84 ton | K17: 0.324344023323615 | L17: electric | M17: iberian | N17: pf | O17: 8 | P17: 289/289 | Q17: 0 | R17: 1 | S17: -1 | T17: [taxi, tandem_verde_cabeza, tandem_verde_cola, tandem_pantone_cabeza, tandem_pantone_cola, 2cc] | U17: [0,1989, 1990,9999, 1999,2013, 1999,2013, 2014,2018, 2014,2018, 0,9999] | V17: bb_289
A18: 310_guardacostas | B18: template | C18: date(1989,01,01) | D18: 3 | E18: 32 | F18: 0 | G18: 0 | H18: 114 km/h | I18: 598 kW | J18: 78 ton | K18: 0.168759811616954 | L18: diesel | M18: iberian | N18: s | O18: 9 | P18: 310/310 | Q18: 0 | R18: 1 | S18: -1 | T18: [cola, FGC_cabeza, FGC_cola, 2cc_cabeza, 2cc_cola] | U18: [0,2008, 0,2008, 2009,9999, 2009,9999, 0,9999, 0,9999] | V18: bobo
A19: 314_ex1400 | B19: template | C19: date(1963,01,01) | D19: 1 | E19: 30 | F19: 0 | G19: 0 | H19: 120 km/h | I19: 824 kW | J19: 86 ton | K19: 0.217133364973896 | L19: diesel | M19: iberian | N19: pf | O19: 8 | P19: 314/314 | Q19: 0 | R19: 1 | S19: -1 | T19: [2cc] | U19: [0,9999, 0,9999] | V19: coco
A20: 316_marilyn | B20: template | C20: date(1955,01,01) | D20: 2 | E20: 38 | F20: 0 | G20: 0 | H20: 120 km/h | I20: 980 kW | J20: 109 ton | K20: 0.190975472757911 | L20: diesel | M20: iberian | N20: pf | O20: 9 | P20: 316/316 | Q20: 0 | R20: 1 | S20: -1 | T20: [verde, 2cc] | U20: [0,1959, 1960,9999, 0,9999] | V20: coco
A21: 319_yanki_iberian | B21: template | C21: date(1965,01,01) | D21: 28 | E21: 56 | F21: 0 | G21: 0 | H21: 120 km/h | I21: 1454 kW | J21: 105 ton | K21: 0.175898931000972 | L21: diesel | M21: iberian | N21: pf | O21: 8 | P21: 319_iberian/319 | Q21: 0 | R21: 1 | S21: -1 | T21: [verde, mil_rayas, estrella, taxi_3_ventanas, taxi_2_ventanas, grandes_lineas, pantone_pasajeros, pantone_mercancias, infraestructura, integria, adif, continental_rail, traccion_rail, 2cc] | U21: [0,1965, 1965,1983, 1984,1985, 1986,1989, 1990,1992, 1993,1995, 1996,2003, 2004,9999, 2004,9999, 1990,2003, 2013,9999, 2004,9999, 2010,9999, 2011,9999, 0,9999] | V21: coco
A22: 319_yanki_standard | B22: template | C22: date(1990,01,01) | D22: 28 | E22: 56 | F22: 0 | G22: 0 | H22: 120 km/h | I22: 1454 kW | J22: 105 ton | K22: 0.175898931000972 | L22: diesel | M22: standard | N22: pf | O22: 8 | P22: 319_standard/319 | Q22: 0 | R22: 1 | S22: -1 | T22: [pantone_mercancias, alquiler, adif, 2cc] | U22: [0,2003, 2004,9999, 2015,9999, 2004,9999, 0,9999] | V22: coco
A23: 321_chata | B23: template | C23: date(1955,01,01) | D23: 0 | E23: 0 | F23: of:=100*124218/234474 -> 52.9773023874715 | G23: of:=7006*100/3046 -> 230.006565988181 | H23: 120 km/h | I23: 1600 hpM | J23: 88 ton | K23: 0.202508794 | L23: diesel | M23: iberian | N23: na | O23: 8 | P23: 321/321 | Q23: 0 | R23: 1 | S23: -1 | T23: [taxi, 2cc] | U23: [0,1990, 1990,9999,0,9999] | V23: coco
A24: 333_rambo | B24: template | C24: date(1974,01,01) | D24: 0 | E24: 0 | F24: of:=100*124218/234474 -> 52.9773023874715 | G24: of:=7006*100/3046 -> 230.006565988181 | H24: 160 km/h | I24: 3.345 hpM | J24: 120 ton | K24: 0.2806122448 | L24: diesel | M24: iberian | N24: na | O24: 8 | P24: 333/333 | Q24: 0 | R24: 0 | S24: -1 | T24: [2cc] | U24: [0,9999, 0,9999] | V24: na
A25: 334_caracol | B25: template | C25: date(2006,01,01) | D25: 15 | E25: 15 | F25: 0 | G25: 0 | H25: 200 km/h | I25: 2394 kW | J25: 90 ton | K25: 0.201814058956916 | L25: diesel | M25: iberian | N25: ep | O25: 8 | P25: 334/334 | Q25: 0 | R25: 1 | S25: -1 | T25: [2cc] | U25: [0,9999, 0,9999] | V25: bobo
A26: 340_huevo | B26: template | C26: date(1966,01,01) | D26: 3 | E26: 21 | F26: 0 | G26: 0 | H26: 130 km/h | I26: 2942 kW | J26: 88 ton | K26: 0.193645640074211 | L26: diesel | M26: iberian | N26: na | O26: 8 | P26: 340/340 | Q26: 0 | R26: 1 | S26: -1 | T26: [2cc] | U26: [0,9999, 0,9999] | V26: bobo

Sheet: Infor
A1: id | B1: Identificador de NML de la locomotora/maquina
A2: date | B2: Fecha de introducción del modelo en formato NML : date(YYYY,MM,DD) (cuidado que el Libreoffice tiene a poner la “D” en mayusculas
A3: modelLife | B3: Tiempo en años que el modelo se puede comprar
A4: vehicleLife | B4: Vida de una maquina comprada
A5: costFactor | B5: Factor de coste de compra respecto al precio base de una maquina de vapor
A6: runningCostFactor | B6: Factor de coste de funcionamiento respecto al precio base de una maquina de vapor
A7: speed | B7: Velocidad en formato NML, por ejemplo 90 km/h
A8: power | B8: Potencia de la maquina en formato NML. “hpM” son caballos de vapor o “cv” que usamos aquí
A9: weight | B9: Peso de la maquina en formato NML, por ejemplo “80 ton”
A10: tec | B10: Factor de esfuerzo de tracción. Se usa para calcular el esfuerzo de tracción maximo de la maquina. Se puede calcular de la siguiente forma : Tec = Te en KNewtons / (9.8 * Peso en Toneladas)
A11: gauge | B11: Track gauge : iberian, standard (aka Spanish high speed tracks), narrow
A12: service | B12: Type of service : p->passengers, ep->express passengers, hp->high speed passengers, f->freight, lf->light freight, hf->heavy freight, ephf->express passengers or heavy freight, hphf->high speed passengers or heavy freig, eplf->express passengers or light freight, fp->freight or passengers, lfep->light freight or express passengers
A13: length | B13: Longitud de la maquina (de 1 a 8). Una unidad representa 4 pixeles de un sprite clasico en la diagonal horizontal (ver gfx/TTD sizes.png)
A14: imageFile | B14: Ruta dentro de la carpeta “gfx” al fichero de imagen con los sprites
A15: effect | B15: Posicion del efecto (vapor, humo y chispas). Rango de valores: [-8,7]
A16: info | B16: Existe informacion adicional para el vehiculo. 1 = SI, 0 = NO. Tener en cuenta que tiene que tener la respectiva cadena en el <idioma>.lang
A17: liveriesNumber | B17: Número de esquemas de color diferentes (exceptuando el esquema por defecto). Si el valor es negativo, toma cada nuevo esquema de un fichero que hay que indicar en liveriesFiles. Si es positivo, lo toma del fichero por defecto
A18: liveriesFiles | B18: Ficheros de los esquemas adicionales. El esquema original (o por defecto) no cuenta en este numero. Si liveriesNumber es negativo, indica los ficheros y las etiquetas de los esquemas. Si liveriesNumber es positiva, solo indica las etiquetas
A19: liveriesNames | B19: Nombres de los esquemas
A20: liveriesYears | B20: Años de los esquemas (incluye el original o por defecto). Debe seguir el siguiente orden: [inicio_esquema_0, fin_esquema_0, inicio_esquema_1, fin_esquema_1, ... inicio_esquema_n, fin_esquema_n]
A22: TEC | B22: TE | C22: g | D22: Peso
A23: of:= [.B23] /([.C23]*[.D23]) -> 0.193645640074211 | B23: 167 | C23: 9.8 | D23: 88
D25: Tec = Te en KNewtons / (9.8 * Peso en Toneladas)
D26: Tec = Te en Kgr / Peso en Toneladas
A28: Coste base | B28: 234474 | D28: Coste real = coefiente * coste base → coeficiente = coste real / coste base
A29: Coste operación base | B29: 3046